source,title,summary,published,link
Российская газета,"Как собрать чемодан в отпуск - список вещей, ручная кладь и багаж","Как собрать чемодан в отпуск и не переплатить за багаж: список вещей, правила ручной клади, ограничения авиакомпаний, жидкости, лекарства и полезные советы.","Mon, 15 Jun 2026 17:57:08 +0300",https://rg.ru/2026/06/15/kak-sobrat-chemodan-v-otpusk-spisok-veshchej-ruchnaia-klad-i-bagazh.html
Российская газета,Рособрнадзор объявил предостережения сразу 19 российским вузам,Федеральная служба по надзору в сфере образования и науки объявила сразу 19 российским вузам предостережения. Информация об этом появилась на официальном сайте Рособрнадзора.,"Mon, 15 Jun 2026 17:54:06 +0300",https://rg.ru/2026/06/15/rosobrnadzor-obiavil-predosterezheniia-srazu-19-rossijskim-vuzam.html
Российская газета,Пещера с сотнями рисунков поведала о ритуалах неолита,"На востоке Турции обнаружена пещера с более чем сотней изображений людей, животных и геометрических символов. По мнению археологов, она могла использоваться как <a href=""http://www.thehistoryblog.com/archives/76301"" rel=""noopener noreferrer"" target=""_blank"">ритуальное место</a> на протяжении многих веков, а возможно, и тысячелетий.","Mon, 15 Jun 2026 17:53:35 +0300",https://rg.ru/2026/06/15/ritualy-neolita.html
Российская газета,Россия остается страной для сезонного летнего отдыха,"Около 40% перелетов по России приходится на период каникул, рассказали в ""Авиасейлс"". Несмотря на рост популярности арктического туризма, Россия остается страной сезонного летнего отдыха. Эксперты считают, что на фоне повышения интереса к путешествиям внутри страны этот сезон может растянуться.","Mon, 15 Jun 2026 17:49:01 +0300",https://rg.ru/2026/06/15/rossiia-ostaetsia-stranoj-dlia-sezonnogo-letnego-otdyha.html
Российская газета,Грациозная рысь попала в видеоловушку в Пензенской области,"Краснокнижную рысь зафиксировали фотоловушки в Пензенской области. Любопытные кадры в соцсетях <a href=""https://vk.com/public_minlespnz?w=wall-186187804_11314"" rel=""noopener noreferrer"" target=""_blank"">опубликовало</a> региональное министерство лесного, охотничьего хозяйства и природопользования.","Mon, 15 Jun 2026 17:47:38 +0300",https://rg.ru/2026/06/15/reg-pfo/gracioznaia-rys-popala-v-videolovushku-v-penzenskoj-oblasti.html
Российская газета,Как сделка США с Ираном отразится на экспорте нефти из России,"Срок действия временного разрешения (лицензии) США для третьих стран на покупку российской нефти истекает в ночь с 16 на 17 июня. Лицензия продлевалась уже дважды сроком на месяц, в апреле и мае этого года, но теперь есть все основания сомневаться в ее дальнейшей пролонгации. Хотя возможны варианты.","Mon, 15 Jun 2026 17:46:45 +0300",https://rg.ru/2026/06/15/bochki-v-dole.html
Российская газета,"Умерла 35-летняя звезда сериала ""Клюквенный щербет"" Эдже Иртем","Популярная турецкая актриса Эдже Иртем, известная по роли Ишил в сериале ""Клюквенный щербет"", скончалась 15 июня в возрасте 35 лет. Как сообщают турецкие СМИ, причиной смерти артистки стал сердечный приступ.","Mon, 15 Jun 2026 17:46:08 +0300",https://rg.ru/2026/06/15/umerla-35-letniaia-zvezda-seriala-kliukvennyj-shcherbet-edzhe-irtem.html
